{
  "version": "0.16.0",
  "date": "2025-12-29",
  "title": "Update",
  "build": {
    "sha": "8087742",
    "num": 27,
    "time": "2025-12-29T08:15:49.522Z"
  },
  "sections": [
    {
      "emoji": "ðŸ’Ž",
      "title": "Improvements",
      "items": [
        {
          "text": "ElevenLabs TTS integration + session docs"
        }
      ]
    }
  ],
  "meta": {
    "fromSha": "131c2df",
    "toSha": "8087742",
    "breaking": false
  }
}