{
  "version": "0.26.0",
  "date": "2025-12-30",
  "title": "Update",
  "build": {
    "sha": "19e88b9",
    "num": 41,
    "time": "2025-12-30T03:23:08.041Z"
  },
  "sections": [
    {
      "emoji": "üíé",
      "title": "Improvements",
      "items": [
        {
          "text": "add voice settings to lobby, default to browser TTS"
        },
        {
          "text": "comprehensive debug console system"
        },
        {
          "text": "move debug console to global help menu"
        },
        {
          "text": "add debug panel for TTS troubleshooting"
        }
      ]
    },
    {
      "emoji": "üêû",
      "title": "Fixes",
      "items": [
        {
          "text": "render VoicePicker modal in lobby phase"
        },
        {
          "text": "prevent StrictMode double-execution of reading logic"
        },
        {
          "text": "move debug console to proper help menu"
        },
        {
          "text": "move voice settings sync effects after state declarations"
        }
      ]
    }
  ],
  "meta": {
    "fromSha": "6b6e23f",
    "toSha": "19e88b9",
    "breaking": false
  }
}