{
  "version": "0.30.0",
  "date": "2025-12-30",
  "title": "Update",
  "build": {
    "sha": "8a49b3b",
    "num": 45,
    "time": "2025-12-30T05:02:57.325Z"
  },
  "sections": [
    {
      "emoji": "üíé",
      "title": "Improvements",
      "items": [
        {
          "text": "add voice settings to lobby, default to browser TTS"
        },
        {
          "text": "comprehensive debug console system"
        },
        {
          "text": "move debug console to global help menu"
        },
        {
          "text": "add debug panel for TTS troubleshooting"
        }
      ]
    },
    {
      "emoji": "üêû",
      "title": "Fixes",
      "items": [
        {
          "text": "replace blocking alert with non-blocking toast for avatar collision"
        },
        {
          "text": "only generate changelog on Vercel (CI), not locally"
        },
        {
          "text": "prevent StrictMode double-execution of TTS side effects"
        },
        {
          "text": "render VoicePicker modal in lobby phase"
        },
        {
          "text": "prevent StrictMode double-execution of reading logic"
        },
        {
          "text": "move debug console to proper help menu"
        },
        {
          "text": "move voice settings sync effects after state declarations"
        }
      ]
    }
  ],
  "meta": {
    "fromSha": "6b6e23f",
    "toSha": "8a49b3b",
    "breaking": false
  }
}