{
  "version": "0.16.1",
  "date": "2025-12-29",
  "title": "Update",
  "build": {
    "sha": "c968bc1",
    "num": 33,
    "time": "2025-12-29T23:29:20.602Z"
  },
  "sections": [
    {
      "emoji": "üêû",
      "title": "Fixes",
      "items": [
        {
          "text": "move voice settings sync effects after state declarations"
        }
      ]
    }
  ],
  "meta": {
    "fromSha": "6b6e23f",
    "toSha": "c968bc1",
    "breaking": false
  }
}