{
  "version": "0.11.1",
  "date": "2025-12-27",
  "title": "Update",
  "build": {
    "sha": "ede8a2a",
    "num": 1,
    "time": "2025-12-27T02:51:40.858Z"
  },
  "sections": [
    {
      "emoji": "ğŸ",
      "title": "Fixes",
      "items": [
        {
          "text": "address playtest feedback - voting, TTS, feedback, and help menu"
        }
      ]
    }
  ],
  "meta": {
    "fromSha": "cb3deee",
    "toSha": "ede8a2a",
    "breaking": false
  }
}