{
  "version": "0.12.1",
  "date": "2025-12-28",
  "title": "Update",
  "build": {
    "sha": "269db39",
    "num": 1,
    "time": "2025-12-28T08:34:51.985Z"
  },
  "sections": [
    {
      "emoji": "ğŸ",
      "title": "Fixes",
      "items": [
        {
          "text": "Remove vote banner entirely (qa-requested)"
        }
      ]
    }
  ],
  "meta": {
    "fromSha": "77b53d2",
    "toSha": "269db39",
    "breaking": false
  }
}