{
  "version": "0.4.0",
  "date": "2025-12-03",
  "title": "Update",
  "build": {
    "sha": "5b6c136",
    "num": 9,
    "time": "2025-12-03T19:19:57.862Z"
  },
  "sections": [
    {
      "emoji": "ðŸ’Ž",
      "title": "Improvements",
      "items": [
        {
          "text": "finalize Phase 3 automation system"
        }
      ]
    }
  ],
  "meta": {
    "fromSha": "d947f4c",
    "toSha": "5b6c136",
    "breaking": false
  }
}