{
  "version": "0.13.1",
  "date": "2025-12-28",
  "title": "Update",
  "build": {
    "sha": "13dbc86",
    "num": 1,
    "time": "2025-12-28T21:44:44.591Z"
  },
  "sections": [
    {
      "emoji": "ğŸ",
      "title": "Fixes",
      "items": [
        {
          "text": "resolve multiple Auto-Claude issues before merge"
        }
      ]
    }
  ],
  "meta": {
    "fromSha": "9046be7",
    "toSha": "13dbc86",
    "breaking": false
  }
}