{
  "version": "0.20.0",
  "date": "2025-12-30",
  "title": "Update",
  "build": {
    "sha": "4fdd3a1",
    "num": 36,
    "time": "2025-12-30T02:31:58.649Z"
  },
  "sections": [
    {
      "emoji": "üíé",
      "title": "Improvements",
      "items": [
        {
          "text": "move debug console to global help menu"
        },
        {
          "text": "add debug panel for TTS troubleshooting"
        }
      ]
    },
    {
      "emoji": "üêû",
      "title": "Fixes",
      "items": [
        {
          "text": "move debug console to proper help menu"
        },
        {
          "text": "move voice settings sync effects after state declarations"
        }
      ]
    }
  ],
  "meta": {
    "fromSha": "6b6e23f",
    "toSha": "4fdd3a1",
    "breaking": false
  }
}