{
  "version": "0.13.3",
  "date": "2025-12-29",
  "title": "Update",
  "build": {
    "sha": "bdc2380",
    "num": 24,
    "time": "2025-12-29T05:37:57.786Z"
  },
  "sections": [
    {
      "emoji": "üêû",
      "title": "Fixes",
      "items": [
        {
          "text": "move startReadingCalledRef declaration before useEffect"
        },
        {
          "text": "critical bugs and enhancements for V0.14"
        }
      ]
    }
  ],
  "meta": {
    "fromSha": "8ac5592",
    "toSha": "bdc2380",
    "breaking": false
  }
}